{
    "seeded": [
        {
            "original_context": "b>`; the exit contract is 0 clean,\n  1 substantive finding, 2 cannot evaluate, 3 crash. The verbs live under `src/CLI/`, one file per\n  n",
            "mutated_context": "b>`; the exit contract is 0 clean,\n  1 substantive finding, 2 a second finding, 3 crash. The verbs live under `src/CLI/`, one file per\n  n",
            "class": "exit-code-drift",
            "id": "seed-01-exit-code-drift",
            "page": "src/GBGCodingTools.jl"
        },
        {
            "original_context": "— PF's script verbatim — and a seeded `WORK_QUEUE.md` in every consumer, no config switch; the tool never reads `WORK_QUEUE.md` for",
            "mutated_context": "— PF's script verbatim — and a seeded `WORK_QUEUE.md` in almost every consumer, no config switch; the tool never reads `WORK_QUEUE.md` for",
            "class": "quantifier",
            "id": "seed-03-quantifier",
            "page": "docs/ARCHITECTURE.md"
        },
        {
            "original_context": "nts | The closure loop runs over the banked findings by id, never by re-running the battery; abandon is the only wholesale exit and names every open id",
            "mutated_context": "nts | The closure loop runs over the banked findings by id, by re-running the battery; abandon is the only wholesale exit and names every open id",
            "class": "inverted-rule",
            "id": "seed-04-inverted-rule",
            "page": "docs/ARCHITECTURE.md"
        },
        {
            "original_context": "bg round close` carries into\n`.claude/WORK_QUEUE.md`, where the Stop hook holds the next session to it. A note is not a mechanism.\nMI",
            "mutated_context": "bg round close` carries into\n`.claude/WORK_QUEUE.md`, where the docs build holds the next session to it. A note is not a mechanism.\nMI",
            "class": "false-mechanism",
            "id": "seed-05-false-mechanism",
            "page": "docs/ARCHITECTURE.md"
        },
        {
            "original_context": " => \"The health check of this package's tooling — config, pinned version, managed files, wiring, ledger, rounds; read-only unless ru",
            "mutated_context": " => \"The health check of this package's tooling — config, installed version, managed files, wiring, ledger, rounds; read-only unless ru",
            "class": "vocabulary-collision",
            "id": "seed-06-vocabulary-collision",
            "page": "src/CLI/Sync.jl"
        }
    ],
    "salt": "2026-09-12-check-docs-01",
    "schema_version": 1,
    "round": "2026-09-12-check-docs-01",
    "skipped": [
        "count-drift"
    ]
}
